{
  "$schema": "./../../docs/info/schemas/config/v1.schema.json",
  "schema_version": 1,
  "id": "tinystg",
  "name": "TinySTG",
  "launcher": "TinySTG.sh",
  "launch": {
    "type": "native",
    "binary": "TinySTG.mipsel"
  },
  "required_file_sets": [],
  "setup_guide": "docs/setup/tinystg.md",
  "setup_guide_url": "https://github.com/tzubertowski/TreeFrogUI_PortsCollection/blob/main/docs/setup/tinystg.md"
}
