{
  "$schema": "./../../docs/info/schemas/config/v1.schema.json",
  "schema_version": 1,
  "id": "sdlzombies",
  "name": "SDL Zombies",
  "launcher": "SDL Zombies.sh",
  "launch": {
    "type": "native",
    "binary": "sdlzombies.mipsel"
  },
  "required_file_sets": [],
  "setup_guide": "docs/setup/sdlzombies.md",
  "setup_guide_url": "https://github.com/tzubertowski/TreeFrogUI_PortsCollection/blob/main/docs/setup/sdlzombies.md"
}
