{
  "$schema": "./../../docs/info/schemas/config/v1.schema.json",
  "schema_version": 1,
  "id": "hexahop",
  "name": "Hex-a-hop",
  "launcher": "Hex-a-hop.sh",
  "launch": {
    "type": "native",
    "binary": "hex-a-hop.mipsel"
  },
  "required_file_sets": [],
  "setup_guide": "docs/setup/hexahop.md",
  "setup_guide_url": "https://github.com/tzubertowski/TreeFrogUI_PortsCollection/blob/main/docs/setup/hexahop.md"
}
