{
  "$schema": "./../../docs/info/schemas/config/v1.schema.json",
  "schema_version": 1,
  "id": "chocolatedoom",
  "name": "Chocolate Doom",
  "launcher": "Chocolate Doom.sh",
  "launch": {
    "type": "native",
    "binary": "chocolate-doom.mipsel"
  },
  "required_file_sets": [],
  "setup_guide": "docs/setup/chocolatedoom.md",
  "setup_guide_url": "https://github.com/tzubertowski/TreeFrogUI_PortsCollection/blob/main/docs/setup/chocolatedoom.md"
}
